mi_quality,transcript_id,interlocutor,utterance_text,client:_talk_type
high,52,client:,"Yeah, and a couple of my friends drink too.",sustain
high,52,client:,I really didn't think about how this would affect me playing sports.,change
high,52,client:,"Yeah, I would like to play soccer in college.",neutral
high,52,client:,"Yeah, I would also like to get scholarships.",neutral
high,52,client:,Yeah.,neutral
high,52,client:,"Well, I will take a look at it, and I'll definitely read it, and I don't wanna become addicted, and I would like to continue to play sports as long as possible.",change
high,52,client:,Thanks for all the information.,neutral
high,63,client:,Definitely.,neutral
high,63,client:,Okay.,neutral
high,63,client:,I do some meth.,neutral
high,63,client:,"Snort it, always snort it.",neutral
high,63,client:,Mm-mm.,neutral
high,63,client:,"Just, you know, some alcohol.",neutral
high,63,client:,Meth?,neutral
high,63,client:,"Um, two, three times a month.",neutral
high,63,client:,Right.,neutral
high,63,client:,Right.,neutral
high,63,client:,"Yeah, it could be because, uh, I was high when I had unprotected sex and I would not do that if I were not high.",change
high,63,client:,"Definitely, yeah.",change
high,63,client:,Yeah.,change
high,63,client:,"No, I mean, no. I mean, like I said, I only do it in clubs, you know, with my friends, uh, two or three times a month at-at the most. Um, uh, I don't think it's really having other impacts. But I'm-I'm concerned about this one. I never expected to get gonorrhea.",change
high,63,client:,"I-I understand but it's I think that would be a hard thing for me to do. You know, I mean, I know I should but, I mean, that's like my whole social life. You know, I mean, all my friends go to these clubs. That's where- that's where I see them. You know, that's my sex life basically and, uh, meth is just- it's just a part of it. You know, I mean, everyone is doing it there. You know, so it's while I would like to stop it's-it's kind of hard to think about doing that right away.",sustain
high,63,client:,"Yeah, I don't think it would be easy but I'm not saying that I'm not willing to try.",change
high,63,client:,Mm-hmm.,neutral
high,63,client:,Mm.,neutral
high,63,client:,"Uh, three.",sustain
high,63,client:,"I mean, this has been really uncomfortable, you know, gonorrhea is a really bad experience. And, uM, I know I don't think the same, you know, when I'm- when I'm on it. And, uh, I mean, what I have is bad enough, I could easily get AIDS. I could get HIV the same way. So that scares me a lot. That's why it's higher than a one or two.",change
high,63,client:,"Well, I do just snort it but you don't know what it's cut with, you know, there could be something, you know. It could be really bad, um, if it was cut with something dangerous or something. I mean, I-I worry about that sometimes.",change
high,63,client:,Yeah.,change
high,63,client:,"Something else to do on weekends, you know, different social life.",change
high,63,client:,"It's the hard thing, I mean, almost everybody I know uses it.",sustain
high,63,client:,My sister.,neutral
high,63,client:,"I haven't really talked to her about it. I think she knows it I do it sometimes. I mean, we're pretty close. I think I could talk to her about it, and I think she would probably help.",change
high,63,client:,Yes.,neutral
high,63,client:,Yes.,change
high,63,client:,Okay.,neutral
high,63,client:,"Yeah, sure.",neutral
high,67,client:,Mm-hmm.,neutral
high,67,client:,Something like that.,neutral
high,67,client:,"Uh, I vape. I have a pen, but I don't smoke it though.",neutral
high,67,client:,"Um, a few times a month.",neutral
high,67,client:,"I did a peppermint oil once, someone shared it with me.",neutral
high,67,client:,Mm-hmm.,neutral
high,67,client:,"Well, I don't think it's going to hurt me.",neutral
high,67,client:,"Um, I don't know. It makes me relax, and it's fun to laugh with my friend.",neutral
high,67,client:,"Well, I don't want to get in trouble like at school.",neutral
high,67,client:,"Well, I can get suspended and I would get kicked off the team, the basketball team.",neutral
high,67,client:,Right.,neutral
high,67,client:,"well, I was thinking to not use when basketball season start.",neutral
high,67,client:,"Well, I play better when I'm not high.",neutral
high,67,client:,"Well, I wouldn't get caught with using a pen, so I wouldn't get kicked off the basketball team.",change
high,67,client:,For about a month.,change
high,67,client:,"Um, seven.",change
high,67,client:,"Well, I'm pretty sure, um, I can stop using for a month. I want to play well.",change
high,67,client:,"Uh, I don't know.",neutral
high,67,client:,"Well, if I'm stressed or unhappy, that's when I usually wanna vape.",change
high,67,client:,"Hmm, I like to play video games.",change
high,67,client:,I can play basketball with my friend Sarah.,change
high,67,client:,Yeah.,change
high,67,client:,Mm-hmm.,change
high,70,client:,"Yeah, I do, just a couple of minutes though.",neutral
high,70,client:,"Um, nothing specific. I just am unfamiliar with the medication.",neutral
high,70,client:,"Okay. Uh, what about side effects?",neutral
high,70,client:,"Um, what about does it interact with phenelzine?",neutral
high,70,client:,"Oh, sure.",neutral
high,70,client:,Thank you.,neutral
high,77,client:,[signs] Kind of slow.,neutral
high,77,client:,Yeah.,neutral
high,77,client:,"Oh, they have me doing all kinds of things in different machines and stuff. Yeah, it hurts.",neutral
high,77,client:,"Well, just about every joint like especially my knees. They're really-- They have me doing some leg things that-that-that is it really necessary?",neutral
high,77,client:,Okay.,neutral
high,77,client:,I wanna go home.,neutral
high,77,client:,"Everything. I wanna- I wanna, play with my dog. I miss my dog. I wanna cook for myself. I'm a very independent person and I wanna do things for myself.",neutral
high,77,client:,"Um, I guess the rehab.",neutral
high,77,client:,Not really.,neutral
high,77,client:,"Oh, yeah.",neutral
high,77,client:,"Uh, I have.",neutral
high,77,client:,"I have a friend who, uh, does it and she just raves about it. She loves it.",neutral
high,77,client:,"Absolutely. I do not want to fall, for sure.",change
high,77,client:,"Well, I-I hadn't really thought about it, but yeah I guess, I guess.",neutral
high,77,client:,"Like I said, my friend talks about it and-and it's very pretty. I've seen pictures, you know.",neutral
high,77,client:,"Well, I don't see how I could do it. I-I'm still in a walker, you know.",sustain
high,77,client:,I could?,neutral
high,77,client:,And you really recommend this?,neutral
high,77,client:,You do Tai Chi?,neutral
high,77,client:,"Oh, okay. Well, yeah. Um, listen, anything that's going to get me home and if you do it and you recommend it, I'll try it.",change
high,77,client:,"Okay, okay.",neutral
high,81,client:,Okay. I guess I've been getting bigger.,neutral
high,81,client:,"Uh, scary I guess.",sustain
high,81,client:,"Yeah. I-I know there's something in there, I just don't know much about him.",neutral
high,81,client:,"I know you want me to see the doctor, I haven't called yet.",sustain
high,81,client:,I don't know. It seems overwhelming to me.,sustain
high,81,client:,"Well, I hate making phone calls and I know I need to fill out all this paperwork. I don't know how to get there and I hate needles.",sustain
high,81,client:,Yes.,neutral
high,81,client:,Can you help me make the call?,change
high,81,client:,Can you go with me to the appointment.,change
high,86,client:,I just feel helpless about this whole deal.,neutral
high,86,client:,Mm. I just feel helpless about this whole deal.,neutral
high,86,client:,No one wants to help me.,neutral
high,86,client:,No one wants to help me.,neutral
high,86,client:,Mm-hmm. I really shouldn't have done it.,neutral
high,86,client:,Mm-hmm. I really shouldn't have done it.,neutral
high,86,client:,Mm-hmm. I couldn't help myself.,neutral
high,86,client:,I couldn't help myself.,neutral
high,86,client:,It's actually been a fabulous week.,neutral
high,86,client:,It's actually been a fabulous week.,neutral
high,86,client:,"Mm-hmm. I know who to hang out with, I'm not stupid.",neutral
high,86,client:,"I know who to hang out with, I'm not stupid.",neutral
high,86,client:,Mm-hmm. I'm letting the whole family down. They had such high hopes for me.,neutral
high,86,client:,Mm-hmm. I'm letting my whole family down. They had such high hopes for me.,neutral
high,86,client:,Mm-hmm. This is not what I want for my life.,neutral
high,86,client:,This is not what I want for my life.,neutral
high,86,client:,Mm-hmm. I really want to get off the program.,sustain
high,86,client:,I really want to get off the program.,sustain
high,86,client:,"Mm-hmm. I still crave smoking, even though I've stopped.",sustain
high,86,client:,"I still crave smoking, even though I've stopped.",sustain
high,86,client:,Mm-hmm.,neutral
high,95,client:,"Um, okay. Just, I don't even know why I'm doing this anymore. I'm-I'm just so stupid. I'm such an idiot. I didn't know what the point of-of this is. I just- I just keep doing the same thing over and over, even though I know it can kill me. I just, I don't have any more willpower, ma'am. Yeah, [foreign language].",sustain
high,95,client:,Mm-hmm.,sustain
high,95,client:,"No, it just seems that cutting myself is the only way out. And I just get suicidal thoughts and [foreign language], I'm just very, very like depressed and what's going on at home.",sustain
high,95,client:,Yeah.,sustain
high,95,client:,"Yes. Sometimes a pain in-in the body. It's, uh, to [unintelligible 00:01:27] handle and-and the pain inside of me.",sustain
high,95,client:,Yes. I am.,sustain
high,95,client:,"Yeah, yeah, suicide.",sustain
high,95,client:,[foreign language],neutral
high,95,client:,"Yeah, 'cause she's a single mom and she struggles a lot. I wanna help her, but I can't help her. So it just makes me sad. I feel like if I don't live anymore, she'll be okay. And she wouldn't have to worry about me or pay my stuff.",sustain
high,95,client:,Yeah.,sustain
high,95,client:,I-I think so?,neutral
high,95,client:,Because it won't be a burden to her.,sustain
high,95,client:,"Because she has to pay for my food and my uniforms, um, to have a roof over our heads.",sustain
high,95,client:,"Um, I try to be a good kid. I tried to go to school. I may not have the best grades, but I'm not failing any classes.",change
high,95,client:,That's the right one.,sustain
high,95,client:,"Um, I don't know. I don't know. It's just, um, I'm not sure I can.",sustain
high,95,client:,"Thank you, ma'am, I feel better.",change
high,95,client:,Okay.,neutral
high,99,client:,"Okay, like what?",neutral
high,99,client:,Mm-hmm.,neutral
high,99,client:,"Yeah, uh, on the weekends?",neutral
high,99,client:,"No, I guess I haven't really thought much of it. Um, you know, I don't really think I drink that much in the first place-",sustain
high,99,client:,-so I have a hard time believing that it's causing my anxiety.,sustain
high,99,client:,"In fact, on the nights when I don't drink, I-I have a harder time going to sleep.",sustain
high,99,client:,"Well, I, yeah, I guess I do have abo-about 2:00 AM, I tend to wake up on the nights I drink too much.",change
high,99,client:,"Jeez, no. I didn't think I was that bad.",neutral
high,99,client:,"I don't know. I mean, this is all news to me. I've, I don't want to do anything to put myself at risk and I've always thought of myself as a pretty healthy guy. I guess I'd put myself right in the middle of the five.",change
high,99,client:,"Well, you know I'm training for the marathon, and that's why I'm coming in, is because I need to be able to get my sleep back on track, but I also don't think of myself as a hazardous drinker, and I'm certainly not an alcoholic. So, that's-that's why the middle-ground, five.",change
high,99,client:,Yes.,neutral
high,99,client:,"Well, I-I think the natural thing would be to cut back a little on my drinking.",change
high,99,client:,"Mm, um, you know, I-I guess drinking no more than maybe three or four times a week, and-and on the weekends, which is when I would drink the most, cup back to no more than five or six beers.",change
high,99,client:,"Um, doing the math, I guess no more than 18 drinks a week.",change
high,99,client:,Thanks.,neutral
high,99,client:,Sure.,neutral
high,104,client:,Okay.,neutral
high,104,client:,Yeah.,neutral
high,104,client:,Yeah. Somewhere around eight days. I'm not sure.,neutral
high,104,client:,"Um, I really only drink at parties. I don't drink at home or anything.",neutral
high,104,client:,"Um, liquor, whenever people are mixing, um, vodka, sometimes beer, but I don't like beer very much. Um, the drinks at parties are usually like vodka and orange juice or gin and tonics.",neutral
high,104,client:,You mean the whole time I'm there?,neutral
high,104,client:,"Um, probably four or five drinks.",neutral
high,104,client:,Yeah. It makes me feel relaxed.,neutral
high,104,client:,Yeah.,neutral
high,104,client:,"Um, I forget how many drinks I've had like when a friend asks me or I forget whose house I'm at.",neutral
high,104,client:,Right.,neutral
high,104,client:,"Um, yeah. I was drinking the last time I had sex. Um, the guy had been drinking too, and we didn't use a condom.",neutral
high,104,client:,Yeah. We've had sex before and we've used a condom before.,neutral
high,104,client:,"Well, we just didn't stop to put one on. We weren't thinking that way.",neutral
high,104,client:,Yeah. I would've definitely told him to put on a condom if I was sober.,change
high,104,client:,"Well, that's not me. I don't need help from anyone.",sustain
high,104,client:,"Um, well, it's fun. I like drinking when my friends are drinking too. Um, I laugh more. It's just fun.",sustain
high,104,client:,"Um, I don't like forgetting where I'm at sometimes.",change
high,104,client:,I really don't want any STDs.,change
high,104,client:,Yeah.,change
high,104,client:,"Well, I definitely don't want to drink too much again.",change
high,104,client:,"Um, a nine.",neutral
high,104,client:,"Well, I really don't want any STDs and I don't like wondering whether I have one or not.",change
high,104,client:,"Um, well, I wanna count my drinks so I don't have more than two and I want to stop drinking once I start feeling drunk.",change
high,104,client:,"Well, I have this friend who thinks I drink too much. She would probably be willing to make me promise not to have more than two drinks at a party.",change
high,104,client:,I'm going to talk with him and I'm gonna make him promise that we always use a condom and that we don't have sex drunk.,change
high,104,client:,Okay.,neutral
high,107,client:,"Um, pretty obvious [chuckles].",neutral
high,107,client:,What do you mean what I did?,neutral
high,107,client:,That's the same as always. Same as always.,neutral
high,107,client:,Yeah.,neutral
high,107,client:,A razor?,neutral
high,107,client:,Do you wanna see it?,neutral
high,107,client:,"I think have you ever been to an ER when you cut yourself, you'd know why I don't go.",sustain
high,107,client:,"I was thinking about killing myself. You thought you would help me and you didn't. That's what I want to talk about. I wanna talk about how it is that my life is not going better and you are not helping me, and you are not available to me when I need help.",sustain
high,107,client:,"I cut myself the first time I called you thinking you would help me, you wouldn't help me so then I figured, what the hell I [chuckles] might as well just go all the way. And so, that's why I cut myself that deep.",sustain
high,108,client:,"Well, um, I have a two-year-old son, and then I work full time as a server at a restaurant, and then recently, I also started going back to night class, so you know, just the combination of all that, you know. I-I've just been feeling really stressed lately.",neutral
high,108,client:,Yeah.,neutral
high,108,client:,"Well, I-I told the counselor that I think childcare is probably my-my biggest issue right now.",neutral
high,108,client:,"Yeah. Um, well, my mom normally watches my son, but lately, it's kind of becoming a problem. You know, she like will back out at the last second, and so I've had to call in at work a couple of times. I've had to miss class a few times. So i-it's just stressful worrying about, you know, whether I'll be able to do those things or not.",neutral
high,108,client:,"Yeah, exactly.",neutral
high,108,client:,"Um, well, I have a sister, but I don't really trust her to watch my son, and I don't really know that many people that-- the only thing I can think of, I have this one neighbor who stepped in and helped one time when my mom backed out. She-she actually has, uh, a three-year-old daughter, so you know, kind of worked out.",neutral
high,108,client:,"Um, I don't really know her that well, but I mean, she seems nice and I-I think she did a pretty good job that night.",neutral
high,108,client:,Yeah.,neutral
high,108,client:,Yeah.,neutral
high,108,client:,Yeah.,neutral
high,108,client:,"I-- you know, I mean, maybe a little bit, but I don't really make that much money to be able to afford something like daycare or, you know, like full time babysitting.",neutral
high,108,client:,"Well, I mean, I-I like cooking. I'm-I'm actually in school for culinary arts.",neutral
high,108,client:,Mm-hmm.,neutral
high,108,client:,"Hmm. That's, that's interesting. I-I never really thought of something like that, but, yeah, it might work.",neutral
high,108,client:,"Hmm. No, I-- you know, there-there just aren't that many people I trust right now with my son.",neutral
high,108,client:,"[chuckles] No, no, not at all. He, he really hasn't been in the picture since my son was born.",neutral
high,108,client:,"It's-it's three nights right now, so I have class on Monday, Wednesday, and Friday nights.",neutral
high,108,client:,"Um, well, you know, if my neighbor could even just take over one day of watching my son, I think that would help my mom quite a bit.",neutral
high,108,client:,"I mean, I think so, yeah.",neutral
high,108,client:,"Mom, you know, just, I guess talking to my neighbor and seeing if she's even interested in this idea, and if she is, you know, telling my mom about it and, you know, hopefully, that will make her feel a little better and maybe a little bit more reliable.",neutral
high,108,client:,Just a couple months from now. He's almost three.,neutral
high,108,client:,"I've heard of it, but I don't know that much.",neutral
high,108,client:,"Yeah, I mean, it sounds like it would be really good for my son and, you know, it would help me out in terms of childcare for sure.",neutral
high,108,client:,"[chuckles] Well, you know, I-I've been working on it a couple of weeks now, and honestly, it's been a lot harder than I expected. Um, trying to break my routine in the evenings, especially has-has been hard, but, um, you know, a couple of nights I have reached my goal in terms of, you know, number of cigarettes I'm going to smoke and number of drinks. So, I mean, I've done okay some days, but others, not so much.",neutral
high,108,client:,"Yeah, yeah. I definitely have, so I-I try to never smoke around him, and if I do smoke at home, I always go out to the balcony to smoke.",neutral
high,108,client:,"Um, well, I guess just first talk to my neighbor and see if she likes this idea, and then if she does, I can talk to my mom about it. Hopefully, that kind of helps her situation out. And then, um, I'm definitely want to look into the Head Start idea because I think that would be really good.",neutral
high,108,client:,Okay.,neutral
high,108,client:,Thanks. All right.,neutral
high,113,client:,Hi.,neutral
high,113,client:,"Well, I came today because my daughter's in the hospital as well. I think it's important to quit, but I enjoy smoking. I'm not ready to give it up right now. My life is too much in turmoil.",sustain
high,113,client:,"I think it's important because I've-- I feel I'm a bad role model for my children, and my daughter's turning 12, and already, some of her friends have tried smoking, so I don't want her to think it's a good thing.",change
high,113,client:,"I smoked when I was young, and I certainly don't want it for her.",change
high,113,client:,"Well, that's true. It seems so hard. I'm just not ready for this right now.",sustain
high,113,client:,"It's very enjoyable, relaxing, you know, a stress reliever. When I'm at work, we all go out and smoke and chit chat and, you know, talk about things. I would hate to not smoke, really. I'd be left out.",sustain
high,113,client:,"Hmm, I like to have a cigarette after I eat. It sort of tells my brain I'm finished, stop eating, I'm full. So it's a- it's a way to-- you know, sometimes I'll have a cigarette instead of a snack, so it's a way to control my weight.",sustain
high,113,client:,"Let me think. Well, I just enjoy it. I think it's, uh-- it's not good for me, I know, but I'm so used to smoking. I don't really think about quitting too much.",sustain
high,113,client:,Okay.,neutral
high,113,client:,That's true. Yeah.,neutral
high,113,client:,Yeah.,neutral
high,113,client:,Exactly.,neutral
high,113,client:,"Well, I-I'm worried about my children. I feel like I'm being a bad parent, and um, I often wonder, you know, they've seen me smoke for years. I certainly don't want my 12-year-old daughter to start smoking, and some of her friends are already smoking.",change
high,113,client:,"Yeah, just this morning, I was outside having a cigarette, and then when I looked up, there she was looking out the window watching me smoke.",change
high,113,client:,"I felt terrible, you know, I was projecting-- I wanna be a good parent, and I don't feel this really is part of the plan.",change
high,113,client:,Mm-hmm.,neutral
high,113,client:,"It doesn't fit, you know. It's the opposite side of the coin. You know, I love to do it, but I don't think it's right.",change
high,113,client:,I can't think of anything right now.,sustain
high,113,client:,I don't have any plans to quit. It's just something I'm thinking about.,sustain
high,113,client:,Exactly.,neutral
high,113,client:,"Oh, sure. Sure, I'll come in. Yeah.",neutral
high,113,client:,We can talk about it some more.,neutral
high,113,client:,"Okay, okay, I'll give it a try.",neutral
high,113,client:,Thank you.,neutral
high,113,client:,All right.,neutral
high,114,client:,"Uh, I guess that sound- that sounds right. I mean, I was- I was kinda drunk and it happened like a week ago. I just, I drove over to my friend's house, um, just to go watch the game and, you know, we're having a couple beers and next thing I know the Vikings are kind of losing pretty big. So we drank a little bit more than usual. And I mean, at the end I had to get home and I couldn't find a ride. So I-I just drove.",neutral
high,114,client:,"Yeah. That's-that's exactly how it happened. I mean, I'm a normal college kid. I like to drink and hanging out with my buddies. I mean, I, it wasn't a big house party or anything and I got busted.",sustain
high,114,client:,"Yeah. I tried to be safe. I mean, I tried to call her roommate, but I don't know, getting in trouble anyways.",neutral
high,114,client:,"Um, well, I wanna say I have a drinking problem. I think I'd probably have more of a, like getting caught problem. I mean, my friends, they-they drink like fishes and I-- they don't ever get caught and you got me over here and I get caught and they left.",sustain
high,114,client:,I guess- I guess more problems with police and school and I really don't have like the time or the money for any of that.,sustain
high,114,client:,"God. It's, I guess, super important, because just-just going to detox alone was-was awful, the experience-- I don't want to do that again. And my dad said if I get suspended from school, um, I have to go- I have to go work on my uncle's farm in Iowa and that would just kill my social life. I won't see any of my friends and I mean, it's already bad enough, like my parents took my car away when I got the DUI.",change
high,114,client:,"Well, I guess I- I guess the easy one is I wouldn't- I wouldn't drink so much and I try to avoid situations where I'm more-more likely to get in trouble. So probably I don't wanna drink so much.",change
high,114,client:,"Um, I guess I would say like, I don't know, like over halfway. So maybe like a six.",neutral
high,114,client:,"I could probably, um, I don't know. I-I guess, well, the big thing would be like kind of where I drink so like drinking like if I'm only like in my apartment so thenI'm not risking myself to drive or like if I- if I go out to a party waiting till, like, I'm 21 to drink. Um, maybe find stuff to do that doesn't revolve around drinking, like, I'm guessing like a town this size there's got to be more to do than just drink.",change
high,114,client:,"Um, I mean, I guess the big one would be like I won't- I won't be hungover all the time like I would make it to my 8:00 AMs then, well, even-even when I make it to my 8:00 AMs now like I just, I sleep like I wake up I'm like, ""Oh my god what's going on?"" And then I get to my 8:00 AM and I'll just sleep through and then miss just about everything that's on the test. So I think if I- if I reprioritize what is important to me, I probably help me succeed. I mean, in high school, I had a 3.5 GPA. So I know I could do it here.",change
high,114,client:,"Um, I mean education is really important to me and-and also my family. My parents are always talking about it and I really- I really wanna be an international journalist, to be on the news like, I mean, I have the face for it, um. So I guess if I reprioritize my- if I reprioritize what I need to do I and I won't drink so much. I probably wouldn't be disappointing my parents and I'd be able to get a really good education.",change
high,114,client:,"All right, all right. When is the seminar?",neutral
