mi_quality,transcript_id,interlocutor,utterance_text,client:_talk_type
high,120,client:,"Oh, thanks so much doctor. I'll just take it easy for a couple of days.",neutral
high,120,client:,"Yeah, I suppose. I know my weight is a problem, but every time I try to take it off, I end up gaining it back. I don't know what to do.",change
high,120,client:,"Okay, thank you doctor, but I'm just concerned about how I can possibly lose weight now since work is so busy and the kids take up so much of my time.",sustain
high,120,client:,"Okay, that sounds great. So, what should I do?",neutral
high,120,client:,"I knew you were gonna say that, but I don't have time in my schedule. I can't afford to take an hour to go to the gym every day.",sustain
high,120,client:,I like to walk.,change
high,120,client:,"Wait a minute, isn't walking too mild to help you lose weight, though?",sustain
high,120,client:,"Oh, wow, that sounds good. You know what? Come to think of it, I have some time before I have to go back to work and I saw a nice park on the way over here, maybe I can take a short walk after this appointment.",change
high,120,client:,"And you know what? I used to really love to dance, but I haven't done that in such a long time.",change
high,120,client:,Hmm. And I know my family would support me if I could just find some place where I can go dancing.,change
high,120,client:,"Yeah, and you know what? I really like to try that.",change
high,120,client:,"Actually, I really would. I'm kind of excited about it. What else you got?",change
high,120,client:,Mm-hmm. I can do that.,change
high,120,client:,"Diet, the D word.",neutral
high,120,client:,"Yeah, I like that. Okay, I'll make an appointment and I'll start dancing right away, doc.",change
high,125,client:,The baby was up all night and I'm exhausted.,neutral
high,125,client:,"Yes. She was up every three hours to eat, I don't understand it.",neutral
high,125,client:,"Yes. My mom told me that I started sleeping through the night when I was a month old, Lilly is six weeks.",neutral
high,125,client:,"Well, what is normal for a baby this age?",neutral
high,129,client:,"Dr. Morrow, I'm so relieved I'm not pregnant.",neutral
high,129,client:,I really feel like I dodged the bullet. That was- that was probably the scariest like two days of my life.,neutral
high,129,client:,Yup.,neutral
high,129,client:,"Yeah, it went so slow.",neutral
high,129,client:,Even just being here today is like minutes ticking by.,neutral
high,129,client:,It's really good news.,neutral
high,129,client:,I don't even know. I'm-I'm not ready to have a kid. I know that. I know my life is not ready for that step.,neutral
high,129,client:,"Yeah, no.",neutral
high,129,client:,"Um, I don't really want to go there. I just-- that sort of stuff just weirds me out. Yeah, I take something fun and just makes it really medical.",sustain
high,129,client:,No.,sustain
high,129,client:,"Yeah, I mean I'm-I'm careful. I do what I can, but I don't wanna take anything for that.",sustain
high,129,client:,"Yeah. It's-it's scary. I mean, this is the first time I've ever had that sort of feeling of ""What am I gonna do?""",neutral
high,129,client:,"And-and that fear was like-- yeah. Up until now, I've been good, yeah.",neutral
high,129,client:,"Yeah. No, it- it's just- it's just weird for me. I don't- I don't like thinking about that stuff, yeah.",sustain
high,129,client:,"Yeah, maybe another time. Just, I'm not ready for it.",sustain
high,129,client:,I'm not ready for that conversation right now.,sustain
high,129,client:,Yeah.,neutral
high,129,client:,Thank you.,neutral
low,9,client:,Sure.,neutral
low,9,client:,Okay.,neutral
low,9,client:,"Not really, I haven't been stressed. Uh, I've been working steady, you know, these days, I'm glad to have a job, I really am happy that I'm working, so.",neutral
low,9,client:,Okay.,neutral
low,9,client:,"I don't smoke. I smoked, you know, as a young adult, quit 20 years ago. I went cold turkey. I was proud of that, haven't even thought about smoking.",neutral
low,9,client:,"Uh, I do drink beer, I drink, you know, two to three pints on weekdays, sometimes on weekends, maybe four or five.",neutral
low,9,client:,"Well, I-- you know, my pressure has been high for years and, um, you know.",neutral
low,9,client:,Maybe a little bit.,change
low,9,client:,Okay.,neutral
low,9,client:,"I don't use heroin or cocaine. I've never even thought about using the hard drugs. Back in school, 20 years or so ago, I smoked reefer, you know. Once I got out of school, I haven't used that at all.",neutral
low,9,client:,"No, I don't- I don't, uh, really like the idea of taking pills. Uh, as a matter of fact, a couple of years ago, I had this jaw surgery. They gave me a prescription for Percocet. I took one, maybe feel weird. I think they're still sitting in the medicine cabinet.",neutral
low,9,client:,"Well, I guess I'll try.",change
low,10,client:,Yeah.,neutral
low,10,client:,"Well, I'm supposed to come to learn about my-- how to manage my diabetes. Just got diagnosed.",neutral
low,10,client:,"Yeah, that's what doctor said. She-she really laid into me about that. Said it was-- I guess, this is really serious stuff. She was talking about losing eyesight, mm, my feet, mm, problems with a lot of other stuff, and it really scared me. Uh, so, [sighs] you know, how-how-how to manage all this, I guess, is what I gotta learn, but it just sounds massive.",neutral
low,10,client:,"That's, uh, that's a huge amount of stuff to do and, I'm not- I'm not certain I can do all that, and on top of it, it's-it's-- if I don't get it all done, all this stuff happens to me?",neutral
low,10,client:,[sighs],neutral
low,10,client:,"Well, I-I [unintelligible 00:01:35]",neutral
low,32,client:,"I-I guess, uh, I don't really remember much. I like it was a week ago, so I was kind of drunk too.",neutral
low,32,client:,"Hmm. I mean, not really. I'm gonna be 21 in a couple of months. Um, once I turn 21, the cops can't give me a minor and I mean, I'm not a heavy drinker, like-like my friends or anything. I don't get wasted at all. And, uh, I just need to be careful. I just won't get caught. I'm just trying to find, like, a normal college student.",sustain
low,32,client:,"Whatever, I-I didn't though. I called my roommates for a ride. He was sleepy. So I had to get home somehow. And this isn't even my fault. I give him rides all the time, but I didn't do anything.",sustain
low,32,client:,"No-no. Like I said, this isn't even my fault. Like, are we done here? I have class in 15 minutes.",sustain
low,32,client:,"Look, I really like going on the [unintelligible 00:02:29] and I get what you're saying. You, you're making some really good points and I'll think about them. Okay?",change
low,32,client:,"$150, are you serious? I can't pay that. All right, I'm done with this. I'm over it.",neutral
low,69,client:,"I'm sorry, but are you the pharmacist? I just had a question about citalopram.",neutral
low,69,client:,"Okay, but I just wanted to know if it interacts with phenelzine?",neutral
low,69,client:,"Okay, thanks for that. I have an appointment to run to.",neutral
low,74,client:,I'm doing all right. How are you?,neutral
low,74,client:,"Oh, I got my lip pierced.",neutral
low,74,client:,Why? I don't know. I wanted a change and-,neutral
low,74,client:,"Well, I mean, nobody needs a piercing, I wanted one. It was a-",neutral
low,74,client:,"Oh, I mean, it's my lip that's pierced, not my teeth.",neutral
low,74,client:,Yeah.,neutral
low,74,client:,Yeah.,neutral
low,74,client:,"I mean, it's been okay so far. It hasn't caused me any problems.",sustain
low,74,client:,Yeah.,neutral
low,74,client:,"I mean, I just put in-",neutral
low,74,client:,"-I'm not gonna take it right out. It's-- Like you said, I've only had it in for a month, I mean.",sustain
low,74,client:,"Well, I mean, if it starts to cause a problem, then maybe we talk about it, but at this point, I mean-",sustain
low,74,client:,-it's fine.,neutral
low,74,client:,Yeah.,neutral
low,74,client:,Yeah.,neutral
low,74,client:,Yeah.,neutral
low,92,client:,Mm-hmm. Yeah.,neutral
low,92,client:,Mm-hmm.,neutral
low,92,client:,"Well, I did a research on the chronic inhaler, and I saw that there were steroids in it, and I do not want my daughter taking steroids. I read about all the side effects of steroids and all the potential health problems. I don't want her taking them, and I just want to tell you right up front, I do not want to hear anything about the fact that I do smoke. Um, I smoke outside, I smoke away from her. I do not ever do it around her. So I do not want to hear about that.",sustain
low,92,client:,"Okay, I-I am not going to allow her to take any kind of steroid. I am not going to allow that to happen. She's my daughter. She's my responsibility, and I'm not going to allow that to happen, and I absolutely make sure that the smoking does not affect her.",sustain
low,92,client:,"Fine. I'm in a really big hurry, and I need to get those prescriptions filled as soon as possible, please.",neutral
low,92,client:,Fine. I just need to get my prescriptions.,neutral
low,102,client:,Sure.,neutral
low,102,client:,"Well, [sighs] I've been thinking about working out lately. I really want to start working out again. It's-it's been in my mind, I know I need to do it. It's just getting the motivation to do it.",change
low,102,client:,Mm-hmm.,neutral
low,102,client:,"Well, I don't know if I'm really being lazy about it. I think it's just that I have a busy schedule.",sustain
low,102,client:,"I just need to find the time to do it. And, yes, I might be lacking a little bit of motivation, but I think it's more timing and trying to fit it in.",sustain
low,102,client:,"But I think that part of the problem is that I-I don't have three to four times- three to four times a week to do it, or an hour even. I mean, hour is a long time because if I'm working out for an hour that means I'm leaving home to get there-",sustain
low,102,client:,"-time there, time back. I mean, it's not just an hour, it's like two hours, realistically.",sustain
low,102,client:,"Well, oh, um, okay.",change
low,102,client:,Okay.,change
low,106,client:,Yeah.,neutral
low,106,client:,"Yeah, it's pretty stressful for both of us. He gets really upset.",neutral
low,106,client:,"Yeah, I-- Yeah, I do smoke, but I don't smoke around him. I try really hard not to smoke around him.",neutral
low,106,client:,"I-I don't know. I mean, I try really hard not to smoke around him. I don't smoke in the car. Um, when he's home, I go outside to smoke. I just-- I mean, I know it's bad, and I know it's bad for him, so I don't want him to be around it so I try really hard.",neutral
low,106,client:,"No, but I don't smoke. I'm-- I-I-I've thought about quitting, but it's just- It's really hard so I just don't know how to do it.",neutral
low,106,client:,"I know, I know. I've heard-- People have told me before, I've heard all that. I just don't know how to do it. How am I supposed to quit? It's-it's so hard.",sustain
low,106,client:,I just don't have time for any of that.,sustain
low,106,client:,"I understand that. I know it is. I mean, everybody has problems, right? It's just really-- It's really, really hard.",neutral
low,106,client:,I don't know.,neutral
low,106,client:,"I'll-I'll-I'll go look at all those things and-and I'll find-- I guess I'll-I'll try to find something, and-and I'll talk to my doctor about it.",change
low,106,client:,"Okay, whatever. Okay.",sustain
low,123,client:,That's great.,neutral
low,123,client:,I don't smoke cigarettes.,neutral
low,123,client:,"Well, the only thing-- I've never smoked cigarettes ever, um, but, um, when, um, when I go out with my friends, um, we like to go to, you know, we like to go out to lounges.",neutral
low,123,client:,"And, um, you know, sometimes they're those- those, uh, nice young men that gift you different sorts of things. And we got some of those mini cigars that are Swisher sweets, they come in peach and-and grape and-and, you know, that's the only time that really, you know, I've ever really used anything that-that's got tobacco in it.",sustain
low,123,client:,"Really? Bad? But they're just little, mini, little, cute little girly cigars.",sustain
low,123,client:,"Well, I only use them just to relax. I mean, it's not like it's something that I would smoke 20 or 30 cigarettes a day, I mean, I only do it when we go out.",sustain
low,123,client:,"Well, I didn't really know I'd started.",sustain
low,123,client:,"I didn't really think that it was anything more than just like social drinking, just something that I do in a social setting when me and my friends go out to the bars.",sustain
low,123,client:,"Uh, maybe.",neutral
low,123,client:,"Well, it's something that I'll have to think about.",neutral
low,123,client:,"Well, it's just something that I do to relax, and I don't do it that often. And so I probably could cut back.",change
low,123,client:,"Well, I don't believe that they are cigars. And what I do believe is that it's a choice and it's my right, and it's something that I choose to do. And so I will think about cutting back, but I'm not at a point where I'm ready to do that. And I'm not really sure that I even believe that what you're telling me is real.",sustain
low,123,client:,"Well, it's something that I'll think about.",neutral
low,126,client:,Yeah. My doctor said he called something in.,neutral
low,126,client:,"No, not really.",neutral
low,126,client:,No.,neutral
low,126,client:,"Okay. Um, why am I taking this medication?",neutral
low,126,client:,"No, I guess not.",neutral
low,126,client:,Yeah. My doctor said he called something in.,neutral
low,126,client:,"No, not really.",neutral
low,126,client:,No.,neutral
low,126,client:,"Okay. Um, so why am I taking this medication?",neutral
low,126,client:,I guess not.,neutral
low,126,client:,Sure. I'm just getting a few groceries.,neutral
low,126,client:,"Well, he told me that I had a blood test for cholesterol, and that I should start taking this.",neutral
low,126,client:,He didn't really tell me. He just phoned it in.,neutral
low,126,client:,"Well, I take all of my other medications right before I go to bed. So I guess I could take it then.",change
low,126,client:,"I store my medications, uh, in my nightstand, right by my bed.",neutral
low,126,client:,No.,neutral
low,126,client:,He didn't mention anything about that.,neutral
low,126,client:,"Sure. I'm just gonna take one tablet right before I go to bed with my other medications. And I guess I will switched to orange juice. And if I notice any muscle pain that is severe, I'll call Dr. Ferris right away.",change
low,126,client:,"Uh, I think you answered all my questions. Thank you.",neutral
low,126,client:,Sure. I'm just getting a few groceries.,neutral
low,126,client:,He told me that I had a blood test for cholesterol so that I should start taking this medication.,neutral
low,126,client:,"He didn't tell me, he just phoned it in.",neutral
low,126,client:,I take all my other medications right before I go to bed. So I guess I could take it then.,change
low,126,client:,I store them all in the nightstand by my bed.,neutral
low,126,client:,No. I don't have any kids.,neutral
low,126,client:,He didn't mention anything about that.,neutral
low,126,client:,"Sure. I'm just gonna take one tablet of the cholesterol statin, uh, in the evening with all my other medications. And I guess I'll switch to orange juice. And if I notice any bad muscle pains, then I'll be sure to call Dr. Ferris right away.",change
low,126,client:,I think you answered all my questions. Thank you.,neutral
